Direction;Price;m2;Floor;Room;Description
 Piso en calle de Géminis, 20, Casco Histórico de Barajas, Madrid ;1200.0;73.0;2;2; Estupenda vivienda de OBRA NUEVA a estrenar! ubicación privilegiada en Barajas, en pleno casco antiguo se encuentra el complejo residencial con 58 viviendas. Vivienda 70 metros cuadrados, EXTERIOR en segunda planta. Consta de salón, 2 dormitorios, 2 baños completos con ducha y mueble en lavabo, coci 
 Piso en La Paz, Madrid ;1150.0;82.0;1;2; Alquiler de temporada SERVICHECK ALQUILA Magnifico piso exterior de 82 m2 construidos, primera planta exterior con ascensor. Muy luminoso y con vistas despejadas al parque. Distribución: Salón comedor con armarios empotrados, dos dormitorios con amplios armarios empotrados. Uno de los dormito 
 Piso en avenida del Ensanche de Vallecas, Ensanche de Vallecas - La Gavia, Madrid ;990.0;80.0;6;2; Magnífico piso de 80m2. Consta de 2 dormitorios (principal en suite), amplio salón comedor independiente, cocina amueblada y equipada con tendedero, 2 baños completos, armarios empotrados en todas las estancias, aire acondicionado y calefacción individual de Gas Natural. El inmueble se entrega recié 
 Piso en calle de Los Mesejo, Adelfas, Madrid ;1200.0;85.0;1;3; ¡SERVICHECK ALQUILA PISO EN MADRID! Para más información y visitas, preguntar por Esther Gil al 602_250_276 (También se atiende por WhatsApp) Este piso de 93 mts en la zona del Retiro se distribuye de la siguiente manera: - Tres habitaciones con ventanas. - Un baño con plato de ducha. - Un sal 
 Piso en calle Paca Díaz, 8, Aravaca, Madrid ;990.0;68.0;1;2; Es orientación Este (cocina y salón) orientación Oeste (las habitaciones). Entra mucha luz y se mantiene con buena temperatura. Además, tiene una casa baja en frente, lo que le da buena ventilación. Piso con mucha luz y AMUEBLADO 2 habitaciones, ambas con ventiladores de techo y armarios empotrados 
 Piso en calle de Mauricio Legendre, Castilla, Madrid ;1450.0;104.0;6;4;" ¡SERVICHECK ALQUILA! APARTAMENTO DE CUATROS DORMITORIOS Contactar a Johana Por llamadas o por whatssApp. ""Maravilloso piso Amueblado, 4 dormitorios, 2 baños completos, cocina con tendedero. Electrodomésticos. Suelo parquet. Caja de seguridad. 4 armarios empotrados. Fachada exterior a Pº Castellan "
 Piso en calle de Géminis, 20, Casco Histórico de Barajas, Madrid ;950.0;55.0;2;1; Estupenda vivienda de OBRA NUEVA a estrenar! ubicación privilegiada en Barajas, en pleno casco antiguo se encuentra el complejo residencial con 58 viviendas. Vivienda 50 metros cuadrados, EXTERIOR en segunda planta. Consta de salón, 1 dormitorio, 1 baño completo con ducha y mueble en lavabo, cocina 
 Piso en calle Colmenares, 5, Chueca-Justicia, Madrid ;3750.0;140.0;1;2; El inmueble se encuentra enclavado en el barrio Justicia del distrito Centro. Es el barrio de moda de Madrid en donde se podrá encontrar nuevos restaurantes, las tiendas y hoteles más vanguardistas de la ciudad. Se trata de un barrio que conserva la arquitectura típica de la ciudad, caracterizado po 
 Piso en calle De Santa Engracia, Almagro, Madrid ;2600.0;130.0;4;3; Foresyco alquila, extraordinario piso de tres dormitorios y dos baños en zona chamberi recien reformado. Zona con todos los servicios y magnificas comunicaciones. Exterior en todas sus habitaciones con mucha luz t balcones en todas las estancias. Sin ruido todos los balcones t sus ventanas y puertas 
 Piso en Principe de Vergara, s/n, Goya, Madrid ;5600.0;162.0;5;4; Se alquila un apartamento exterior de 160 metros cuadrados ubicado en la prestigiosa calle Príncipe de Vergara, en las proximidades de Retiro, Serrano y Jorge Juan. El apartamento consta de un amplio salón-comedor, una cocina independiente, 4 dormitorios y 3 baños. Tres de los dormitorios cuentan c 
 Piso en calle de la Hierbabuena, Berruguete, Madrid ;1300.0;62.0;3;2; Magnifica vivienda en alquiler de 2 dormitorios completamente amueblada y equipada, ubicada en la tercera planta de un edificio moderno de reciente construccion con orientacion este. Entre sus principales caracteristicas, destacamos su carpinteria exterior en aluminio lacado con cristal climalit y v 
 Piso en Niño Jesús, Madrid ;3600.0;214.0;6;4; Amplio y luminoso ático en Retiro Engel & Völkers les ofrece este luminoso y espacioso ático exterior en excelente estado de conservación. El pasillo de entrada da acceso a la cocina totalmente equipada (Nevera americana, horno, vitrocerámica, campana, lavadora y secadora) y un amplio salón con dos 
 Piso en calle de Villanueva, Recoletos, Madrid ;2450.0;59.0;4;1; ALQUILER POR MESES (MINIMO 1 MES) PRECIO INLCUYE SUMINISTROS Y WIFI DE ALTA VELOCIDAD RECIEN REFORMADO Situado en Recoletos, cerca del PARQUE RETIRO, LA PUERTA DE ALCALA y los metros Retiro, Serrano, Velazquez.. . rodeado de los restaurantes y tiendas mas exclusivas de la ciudad, cuenta con salón-c 
 Piso en Conde de Peñalver, Goya, Madrid ;2700.0;110.0;2;3; ***Cerca IE Business schools**** 3 habitación con cama doble*** MC Property alquila estupendo piso de 110 m2, en la segunda planta, en c/Conde de Peñalver, en el **Barrio de Salamanca**. ***IDEAL FAMILIAS*** La vivienda se distribuye en: hall de entrada, un distribuidor que lleva al salón comedor 
 Piso en calle de San Nazario, 1, Prosperidad, Madrid ;1100.0;85.0;2;2; Alquilo piso luminoso a un minuto del metro de Alfonso XIII. Exterior. Consta de dos dormitorios (uno con vestidor), salón con terraza, cocina y baño. Sin amueblar, con electrodomésticos (nevera, lavadora y microondas). Tiene armarios. Ascensor y portero. En una zona con todos los servicios y muy b 
 Piso en avenida de Juan Antonio Samaranch, Valdebebas - Valdefuentes, Madrid ;3000.0;101.0;0;3; Fantastico y luminoso piso en Valdebebas Engel & Völkers presenta en alquiler en el nuevo y privilegiado barrio de Valdebebas, este coqueto piso con una maravillosaterraza con vistas al parque de Valdebebas. Ubicación inmejorable. Calidades de lujo. Amplio salón comedor con salida a balcón y la terr 
 Piso en calle de Bremen, 3, Guindalera, Madrid ;2150.0;70.0;0;2; Piso recién reformado, con dos espaciosas habitaciones, cada una con baño en suite. Amplia cocina, salón y comedor. A un minuto caminando de la Av de Bruselas donde se encuentran todo tipo de servicios como Supermercados, Farmacias, Bancos, Restaurantes, entre otros. A 3 minutos caminando de la Esta 
 Piso en Arapiles, Madrid ;1770.0;40.0;0;1;" GASTOS INCUIDOS!!   [ESP] DISPONIBLE EN: Octubre. Reserve en línea haciendo clic bajo el mapa en ""Enlace adicional"". [ENG] AVAILABLE FROM: October. Book online by clicking on ""additional link"" under the map. [ESP] No se aceptan alquileres inferiores a 5 meses [ENG] Rentals of less than 5 months are not accepted [ "
 Piso en calle de Francos Rodríguez, 33, Bellas Vistas, Madrid ;1350.0;70.0;5;1; Piso amplio y muy luminoso, todo exterior, amueblado, portero físico, buenas calidades, suelo de madera de iroko, muy buen estado, calefacción central y aire acondicionado con bomba de calor. La vivienda consta de, - Amplio salón comedor de 28m2, exterior y orientado a Sur, amueblado, con aire acon 
 Estudio en calle de Valverde, Malasaña-Universidad, Madrid ;799.0;;0;0; Para mayor información y visitas contactar con esther gil al 602_250_276 (también se atiende por whatsapp) para una mejor experiencia visual, visita nuestro 3d. Disponibilidad inmediata, para cortas estancias consultar precios. Coqueto estudio, con sofa y cama extensible 2 armarios empotrados y 
 Piso en calle la Rábida, 22, Bellas Vistas, Madrid ;1700.0;130.0;4;3; Particular, directamente sin comisiones. Piso de tres dormitorios y dos cuartos de baño completos, uno de ellos incluido en el dormitorio tipo suite. Todos los dormitorios tienen armarios empotrados y forrados. Cocina amueblada con electrodomésticos nuevos y con terraza tendedero. Salón comedor con 
 Piso en calle del Conde de Peñalver, s/n, Lista, Madrid ;3040.0;69.0;2;2; Este piso completamente amueblado y listo para disfrutar está disponible desde 25-10-2023. Ofrecemos precios personalizados para cualquier duración. Las tarifas pueden variar según las fechas exactas de entrada y salida. La tarifa de este piso comienza en €2,940* / mes. Visite nuestro sitio web e i 
 Piso en Av. de Menéndez Pelayo, 67, Niño Jesús, Madrid ;1850.0;82.0;2;1; Para más viviendas como está, visita nuestra pagina web bepremiumrealestate. net (enlace al final del anuncio). Be premium real estate ofrece en alquiler estupendo piso de diseño cerca al parque del Retiro, Madrid La vivienda se distribuye en: amplio salón/comedor con grandes ventanales, cocina in 
 Piso en calle de López Silva, Lavapiés-Embajadores, Madrid ;1700.0;75.0;2;3; Este excepcional piso de 3 dormitorios ofrece una oportunidad única para experimentar el corazón de Madrid en uno de sus barrios más animados y auténticos: Lavapiés. Con una ubicación privilegiada y una combinación perfecta de comodidades modernas y encanto tradicional, este piso es ideal para aquel 
 Ático en calle de Julián Romea, Vallehermoso, Madrid ;1450.0;75.0;8;2; ****YA DISPONIBLE ****ATICO** ESTANCIA MINIMA 1 AÑO Novarent alquila magnifico ático muy luminoso con 75m2 de vivienda junto a metro Islas filipinas, Guzman el Bueno y Vicente Aleixandre La vivienda se distribuye en una cocina recien reformada, totalmente equipada (nevera, vitrocerámica, microonda 
 Piso en calle de Serrano, s/n, El Viso, Madrid ;2900.0;50.0;4;2; Este piso completamente amueblado y listo para disfrutar está disponible desde 06-11-2023. Ofrecemos precios personalizados para cualquier duración. Las tarifas pueden variar según las fechas exactas de entrada y salida. La tarifa de este piso comienza en €2,570* / mes. Visite nuestro sitio web e i 
 Piso en Aravaca, Madrid ;2650.0;157.0;1;4; My Homes Properties alquila en exclusiva fantástico piso de 157,12 m2, con 4 habitaciones, 3 baños completos y aseo, situado en urbanización de Aravaca, con piscina común, dos plazas de garaje y trastero incluidos en el precio. Bien comunicada por autobús y tren de cercanías, con parque infantil pró 
 Piso en calle de Leganitos, s/n, Palacio, Madrid ;2050.0;69.0;2;1; Este piso completamente amueblado y listo para disfrutar está disponible desde 07-11-2023. Ofrecemos precios personalizados para cualquier duración. Las tarifas pueden variar según las fechas exactas de entrada y salida. La tarifa de este piso comienza en €1,860* / mes. Visite nuestro sitio web e i 
 Piso en calle de Escalona, 82, Aluche, Madrid ;780.0;80.0;4;3; Alquilo piso en la calle Escalona cerca a la estación de metro campamento, supermercados, colegios y colegios mercado Copasa. La vivienda se distribuye en 3 habitaciones, 1/4 de baño, salon comedor y cocina totalmente equipada con una nevera combi, lavadora, lavavajillas, campana extractora, vitroce 
 Piso en calle de Ayala, s/n, Recoletos, Madrid ;2640.0;53.0;1;2; Este piso completamente amueblado y listo para disfrutar está disponible desde 07-11-2023. Ofrecemos precios personalizados para cualquier duración. Las tarifas pueden variar según las fechas exactas de entrada y salida. La tarifa de este piso comienza en €2,310* / mes. Visite nuestro sitio web e i 
 Piso en Aravaca, Madrid ;1350.0;90.0;0;2; Bajo de 90m2 + 30m2 de jardín. La vivienda cuenta con: cocina equipada con electrodomésticos (lavadora lavaplatos y nevera), tendedero, dos dormitorios y dos baños (uno de ellos en suite) y amplio salón-comedor con salida directa al jardín privado. Magnífica dotación de armarios y espacio de almacen 
 Piso en Goya, Madrid ;2500.0;77.0;0;2; Bello piso de dos habitaciones Hermosilla Engel & Völkers les presenta esta estupenda propiedad en alquiler en el barrio de Salamanca, Lista. Se trata de una vivienda situada en una séptima planta de unos 65 m2. De reciente construcción, la vivienda consta de dos dormitorios, ambos dan al exterior, 
 Piso en calle de los Geranios, 32, Ventilla-Almenara, Madrid ;1200.0;45.0;1;1; Piso de una habitación recién reformado. Excelente situación, con metro Ventilla, Plaza Castilla y Chamartin. Situado entre las 4 Torres, las Torres Kio. Al lado del Hospital de La Paz y Carlos III y de la universidad ie. - Cocina equipada - Armario empotrado - Sala amueblada - trastero grande 
 Piso en calle de Antonia Ruiz Soro, s/n, Guindalera, Madrid ;2230.0;75.0;3;2; Este piso completamente amueblado y listo para disfrutar está disponible desde 06-11-2023. Ofrecemos precios personalizados para cualquier duración. Las tarifas pueden variar según las fechas exactas de entrada y salida. La tarifa de este piso comienza en €2,180* / mes. Visite nuestro sitio web e i 
 Dúplex en calle de los Padres Dominicos, 4, Sanchinarro, Madrid ;1175.0;75.0;0;1; LEONOR LOPEZ & ASOCIADOS, presenta este bonito Loft amueblado para vivienda con jardín privado, cerca de El Encinar de los Reyes y la Moraleja, ideal para quienes buscan un espacio moderno y cómodo, a escasa distancia de Centros Comerciales, Supermercados y Restaurantes. La vivienda está en perfecto 
 Piso en calle de la Princesa, s/n, Malasaña-Universidad, Madrid ;2400.0;74.0;14;1; Este piso completamente amueblado y listo para disfrutar está disponible desde 02-12-2023. Ofrecemos precios personalizados para cualquier duración. Las tarifas pueden variar según las fechas exactas de entrada y salida. La tarifa de este piso comienza en €2,390* / mes. Visite nuestro sitio web e i 
 Dúplex en calle del Amparo, Madrid, Lavapiés-Embajadores, Madrid ;1450.0;70.0;1;2; Precioso Duplex reformado y completamente amueblado, de dos habitaciones gran salón comedor, cocina equipada con friega-platos incluido, y baño completo. La habitación principal es muy luminosa, y cuenta con cama doble armarios empotrados, y un gran ventanal, tipo velux. La habitación de invitados c 
 Piso en calle de José Marañón, s/n, Trafalgar, Madrid ;2900.0;115.0;0;2; Este piso completamente amueblado y listo para disfrutar está disponible desde 06-11-2023. Ofrecemos precios personalizados para cualquier duración. Las tarifas pueden variar según las fechas exactas de entrada y salida. La tarifa de este piso comienza en €2,890* / mes. Visite nuestro sitio web e i 
 Dúplex en calle del Amparo, Lavapiés-Embajadores, Madrid ;1450.0;75.0;1;2; Precioso duplex recién reformado de 2 habitaciones con amplio salón y cocina integrada, y completamente equipada, con aire acondicionado y bomba de calor. Gastos de comunidad incluidos. La calefacción es central pero el inquilino paga según el consumo que haga de la misma, existen unos medidores par 
 Piso en calle de Martín de los Heros, s/n, Argüelles, Madrid ;1860.0;26.0;3;1; Este piso completamente amueblado y listo para disfrutar está disponible desde 03-12-2023. Ofrecemos precios personalizados para cualquier duración. Las tarifas pueden variar según las fechas exactas de entrada y salida. La tarifa de este piso comienza en €1,720* / mes. Visite nuestro sitio web e i 
 Piso en Lavapiés-Embajadores, Madrid ;1400.0;71.0;5;2; Piso exterior muy luminoso y tranquilo en calle Ave María, 5ª planta con ascensor, 2 balcones con preciosas vistas (con total aislamiento térmico y sonoro), edificio completamente rehabilitado, paredes lisas, suelo de madera de haya, aire acondicionado frío/calor, calefacción individual, cocina tota 
 Piso en Pavia, Palacio, Madrid ;2800.0;134.0;4;2; En alquiler y/o a la venta una propiedad espectacular en un edificio histórico. Exclusiva vivienda frente al Palacio Real y en plena Plaza de Oriente, con vistas a los Jardines de Sabatini, y al Palacio. Recomendamos VER el TOUR VITUAL 3D para identificar todas las estancias. Lista para entrar a 
 Piso en calle de Manuela Malasaña, 28, Malasaña-Universidad, Madrid ;850.0;35.0;2;1; Bonito apartamento amueblado en el corazón del barrio de Malasaña a escasos metros de las estaciones del metro de Bilbao y San Bernardo con numerosos supermercados en la zona, bares, restaurantes, teatros y cines. El apartamento se encuentra en un precioso edificio singular rehabilitado de 1.906. E 
 Piso en calle Corral de Almaguer, 12, Ensanche de Vallecas - La Gavia, Madrid ;799.0;38.0;1;1; ¡Sin comisiones de agencia!   Y AHORA ALQUILANDO CON NESTAR, LLÉVATE UN 5% DE DESCUENTO EN IKEA EN EL AMUEBLAMIENTO DE TU NUEVA CASA. (*sujeto a condiciones) Moderna urbanización privada en el Ensanche de Vallecas. El recinto cuenta con una piscina abierta, grandes espacios comunes y un parque infantil propio. Bonitas vivienda 
 Dúplex en calle de Agustín Durán, 29, Guindalera, Madrid ;1800.0;135.0;0;2; Alquilamos, como particulares (no lo gestiona una agencia inmobiliaria), un dúplex de diseño tipo loft, totalmente amueblado, a 5 minutos del metro Diego de León y del Hospital de la Princesa. La vivienda está compuesta por dos plantas, con una superficie total de 120m² útiles y 135m² construidos, 
 Piso en avenida de Valdemarín, Valdemarín, Madrid ;2750.0;180.0;0;4; Fantástico bajo con terraza en Valdemarin Engel & Völkers presenta en alquiler disponible inmediatamente totalmente pintado y vacío este espectacular bajo de 4 habitaciones en el corazón de Valdemarin-Aravaca. La vivienda cuenta con 180m2 + 150 de terraza cómodamente distribuidos en hall de entrada, 
 Piso en albadalejo, 46, Simancas, Madrid ;850.0;70.0;4;1; Fantástico apartamento de 40 metros, un dormitorio independiente, en urbanización cerrada con todos los servicios (conserjería 24h, piscina, zonas verdes) Completamente equipado, exterior, luminoso, 4a planta de 6, con ascensor. Trastero y plaza de garaje incluidos. Barrio residencial a 10 min del 
 Piso en Argüelles, Madrid ;2400.0;151.0;1;4; Luminoso y amplio piso en Argüelles en alquiler Posibilidad de amueblar parcialmente según necesidades del inquilino, para largas estancias. Engel & Völkers presenta esta encantadora propiedad de excelentes calidades, ubicada en una de las mejores zonas de Madrid, como es el elegante Barrio de Argüe 
 Piso en Chopera, Madrid ;1070.0;45.0;3;2; Propietario particular ofrece excelente inmueble ubicado en la zona privilegiada del Barrio de Chopera, Distrito de Arganzuela. La vivienda se encuentra situada a 5 minutos a pie de Matadero Madrid, Madrid Río y de la estación de metro de Legazpi y a 20 minutos a pie de la estación de Atocha. El ba 
 Chalet pareado en Conde Orgaz-Piovera, Madrid ;4800.0;448.0;0;5; Colomba Boutique Inmobiliaria alquila, Chalet no amueblado de alto standing, muy luminoso y soleado con 5 habitaciones y 5 baños. Distribución: Planta calle: Amplio hall de entrada con armario gabanero, aseo, salón con chimenea y comedor. Cocina totalmente equipada, con office. Espacio para una m 
 Piso en carril del Conde, 81, Canillas, Madrid ;3700.0;176.0;2;4; DISTRIBUCIÓN: Vivienda con 4 dormitorios y 3 cuartos de baño, bien distribuida, con amplios ventanales de suelo a techo, completamente orientada al sur y con ventilación cruzada por ventana en el salón que está orientada al oeste. 3 baños interiores con ventilación forzada constante: uno de ellos c 
 Piso en Conde Orgaz-Piovera, Madrid ;2500.0;100.0;4;3; Colomba Boutique Inmobiliaria, alquila EN EXCLUISIVA, piso amueblado con mucho encanto, vistas maravillosas vistas y altas calidades. Urbanización construida en 2008, con altas calidades, y todos los servicios: piscina de 25m, pádel, gimnasio, sauna, jardines, zona de juegos para niños, ping-pong, 
 Piso en calle del Alcalde Sáinz de Baranda, 4, Ibiza, Madrid ;1700.0;87.0;3;3; ¡ABSTENERSE AGENCIAS! Preciosa vivienda con vistas al parque de El Retiro. Se trata de un piso que consta de un amplio hall-recibidor con armario empotrado, salón-comedor con balcón a c/ Alcalde Sáinz de Baranda y cocina independiente equipada con electrodomésticos. 3 dormitorios y 1 baño grande. Es 
 Dúplex en San Juan Bautista, Madrid ;4100.0;247.0;4;4; EXCELENTE PISO REFORMADO ALTAS CALIDADES   Colomba Boutique Inmobiliaria, alquila, piso DUPLEX CON REFORMA INTEGRAL A ESTRENAR. La vivienda es muy luminosa y todas las estancias son exteriores, salvo un baño y el aseo de cortesía. La distribución es la siguiente: - PLANTA INFERIOR: vestíbulo-distribuidor desde el que se accede al amplio s 
 Piso en calle de la Ruda, Lavapiés-Embajadores, Madrid ;900.0;55.0;1;1; PENDIENTE REPORTAJE FOTOGRAFICO DISPONIBLE NOVIEMBRE 2023 Se entrega en perfecto estado COCINA EQUIPADA MEJOR VEN A VISITAR TE ENAMORARA Si buscas larga duración, posibilidades. ¿CUANDO NOS VEMOS? VEN A CONOCER este precioso y coqueto piso en el centro de Madrid. En el barrio de Lavapies, uno d 
 Piso en Nuevos Ministerios-Ríos Rosas, Madrid ;2800.0;157.0;5;3; Piso de 3 dormitorios y 2 baños Engel & Völkers presenta esta acogedora vivienda NO AMUEBLADA ubicada en el edificio Géminis I. Se trata de un piso exterior, que se distribuye en salón-comedor, cocina, 3 dormitorios y 2 baños. El hall de entrada da por un lado paso al amplio salón-comedor, y por otr 
 Piso en calle Alcalá, 84, Goya, Madrid ;5800.0;120.0;1;3;" ""Alquiler por meses"" ""No se cobra comisión de Agencia"" ""Suministros incluidos"" Espectacular apartamento de 3 habitaciones en el barrio de Salamanca, al lado del Parque del Retiro. Decoración original, contemporánea, mobiliario combinando estilo y confort. Está decorado en tonos neutros con toques de "
 Piso en calle de Víctor Hugo, Chueca-Justicia, Madrid ;3345.0;174.0;2;2; Espectacular apartamento exterior de 2 dormitorios, en el Centro Histórico de Madrid   DISPONIBLE PARA ENTRADAS INMEDIATAS ** Precio variable: Larga estancia (+ 9 meses) 3.345€/mes = 3.040, 90€ + 10% IVA Media estancia (4-9 meses) 3.745€/mes = 3.404, 54€ + 10% IVA Corta estancia (1-4 meses) 4.245€/mes = 3.859, 09€ + 10% IVA** Suministros incluidos en corta estancia En el centro hist 
 Piso en calle de Martínez, Berruguete, Madrid ;1550.0;43.0;1;1; Servicheck Alquila Piso por Temporada en Madrid! Disponible a partir del 30 de Abril 2023! Para mas información y visitas contactar con Diana Trujillo al 692_904_114 (También se atiende por WhatsApp) Vivienda destinada a alquiler por temporada. Especialmente pensada para empresas o profesionales. 
 Estudio en Acacias, Madrid ;790.0;;0;0; Para más información preguntar por Pablo Martin al 602_250_267 (también se atiende por WhatsApp). Se alquila pequeño estudio amueblado con cocina completa estilo americana, cuarto de baño y salón (habitación), falta el sofá cama, en caso de quererlo se coloca. Ubicación inmejorable, en una de las 
 Piso en calle Alejandro Casona, Peñagrande, Madrid ;1400.0;85.0;2;2; VIVIENDA exterior 75 metros útiles, distribuidos en dos dormitorios, con armarios empotrados, cuarto de baño con bañera, y aseo, salón amplio con terraza y vistas a la piscina, cancha de tenis, cocina amueblada a falta de la lavadora, terraza tendedero, recién pintado y suelos recién instados, bonit 
 Piso en calle de Alejandro Morán, 8, Puerta Bonita, Madrid ;997.0;67.0;1;2; PARTICULAR-OPORTO. Sin comisión-REFORMA Integral hace 3 años. Amueblado. Disponibilidad inmediata. Contacto preferible por Whatsapp Salón con cocina americana, equipado con aire acondicionado, lavavajillas, horno, vitro, microondas. 2 habitaciones dobles, en una de ellas pequeña terraza muy agrada 
 Piso en Sol, Madrid ;2100.0;100.0;5;2; Piso en calle mayor a 100 de Sol. Dos habitaciones, salón con chimenea, cocina, comedor, cuatro de baño completo y aseo. Muy luminoso y tranquilo. Suelo y carpintería en madera noble de pino meli. Se entrega sin amieblar pero se puede negociar poner muebles. Cocina amueblada con electrodomésticos. P 
 Piso en calle de los Fundadores, 23, Fuente del Berro, Madrid ;1200.0;65.0;3;2; CALEFACCIÓN CENTRAL Y PLAZA DE GARAJE INCLUIDOS Sweet Home alquila confortable y agradable piso, en ubicación excelente cercana a calle Manuel Becerra y calle Doctor Esquerdo. En 3º planta a gran patio de manzana, muy luminoso. El piso consta de cocina amueblada y equipada con cocina, campana extra 
 Piso en paseo de San Francisco de Sales, Vallehermoso, Madrid ;3500.0;200.0;2;4; CONTRATO DE TEMPORADA: MÁXIMO 11 MESES. WIFI INCLUIDO. Oportunidad de alojarte en una espectacular vivienda, recientemente reformada a capricho, amueblada, muy luminosa debido a su orientación SUR, con TERRAZA y ubicada en una finca con conserje y ascensor. Posibilidad de plaza de garaje para coche 
 Piso en Canillas, Prosperidad, Madrid ;1545.0;30.0;0;1; ESPECTACULAR APARTAMENTO EN PROSPERIDAD! Alquiler Temporal mínimo 6 meses a 11 meses. ALQUILER: 1.315 € mes. SUMINISTROS INCLUIDOS: 230 € mes (luz+agua+internet+Limpieza). hasta un consumo máximo de 65 €/mes suministro. Ubicado en un bajo exterior, con diseño moderno y muy luminoso, es ideal para 
 Piso en calle de Serrano, El Viso, Madrid ;2600.0;120.0;0;3; Alquiler de magnifico piso con amplio jardín. La vivienda consta de 2 dormitorios con baño en suite, más un dormitorio de servicio con baño y aseo de invitados. Cocina con office y todos los electrodomésticos (lavadora, nevera, lavavajillas, horno, vitrocerámica) Salón con chimenea y comedor que 
 Piso en calle del Cardenal Cisneros, 82, Trafalgar, Madrid ;1300.0;50.0;1;2; Precioso apartamento de dos habitaciones, situado en una 1 planta interior con mucha luz, totalmente reformado, ventanas en todas las estancias, tarima de madera y calefacción por radiadores cerámicos programables. Tiene 2 habitaciones, la principal con cama doble y armario empotrado. La segunda ha 
